[
  {
    "schemaVersion": "pansphaira.cscl01/evidence-cell/v1",
    "systemId": "erpnext",
    "questionId": "objects-roles",
    "state": "SUPPORTED",
    "equivalenceProof": {
      "nativeMeaningSha256": "ebe3ae9539938c1f3513e111f2d1eeed93ca952fdd1afdbfc0aef646620f1ad9",
      "candidateMeaningSha256": "c1ef126fbb1cf4020a80530bf53462fb25377c78cbdb4a4f3d5ab00748cb6ef7"
    },
    "evidence": [
      {
        "sourceFactId": "erpnext.party-customer-management.objects-roles",
        "exactLocator": "https://raw.githubusercontent.com/frappe/erpnext/b24c9eba551905e256e336ff170a91a92d197a2f/erpnext/selling/doctype/customer/customer.json#bytes=158-3245",
        "excerptSha256": "8361a55ecfc4bada866422404c7ea1d14c6ab351b5d5f98a3568151143837d7d"
      }
    ],
    "counterexamples": [],
    "boundary": {
      "authorityGrant": "NONE",
      "promotionGrant": "NONE",
      "executionGrant": "NONE"
    }
  },
  {
    "schemaVersion": "pansphaira.cscl01/evidence-cell/v1",
    "systemId": "erpnext",
    "questionId": "relations",
    "state": "SUPPORTED",
    "equivalenceProof": {
      "nativeMeaningSha256": "e32bd2fe29bfa36fa37315ca8a9129ac456cd483ad2b2105f80310ebf70051ce",
      "candidateMeaningSha256": "c1ef126fbb1cf4020a80530bf53462fb25377c78cbdb4a4f3d5ab00748cb6ef7"
    },
    "evidence": [
      {
        "sourceFactId": "erpnext.party-customer-management.relations",
        "exactLocator": "https://raw.githubusercontent.com/frappe/erpnext/b24c9eba551905e256e336ff170a91a92d197a2f/erpnext/selling/doctype/customer/customer.json#bytes=4102-8489",
        "excerptSha256": "966bd0c803f8763d8e91e411bac8a9dfb7270e1dfb518b77ea79acc9b8f333a4"
      }
    ],
    "counterexamples": [],
    "boundary": {
      "authorityGrant": "NONE",
      "promotionGrant": "NONE",
      "executionGrant": "NONE"
    }
  },
  {
    "schemaVersion": "pansphaira.cscl01/evidence-cell/v1",
    "systemId": "erpnext",
    "questionId": "operations",
    "state": "SUPPORTED",
    "equivalenceProof": {
      "nativeMeaningSha256": "04ef93e829234b399fcea2deea2a2404c6f5d8aad9c0cddb1e842e107c134a6e",
      "candidateMeaningSha256": "c1ef126fbb1cf4020a80530bf53462fb25377c78cbdb4a4f3d5ab00748cb6ef7"
    },
    "evidence": [
      {
        "sourceFactId": "erpnext.party-customer-management.operations",
        "exactLocator": "https://raw.githubusercontent.com/frappe/erpnext/b24c9eba551905e256e336ff170a91a92d197a2f/erpnext/selling/doctype/customer/customer.py#bytes=3863-14218",
        "excerptSha256": "e8f5f90c364a2660db8a3525c058aacf1dfb43a799543c3796ad1d38d7b68930"
      }
    ],
    "counterexamples": [],
    "boundary": {
      "authorityGrant": "NONE",
      "promotionGrant": "NONE",
      "executionGrant": "NONE"
    }
  },
  {
    "schemaVersion": "pansphaira.cscl01/evidence-cell/v1",
    "systemId": "erpnext",
    "questionId": "inputs-outputs",
    "state": "SUPPORTED",
    "equivalenceProof": {
      "nativeMeaningSha256": "015d35b520fac10169525845e489ef06acdf79bbd6f36db81eafaa2aed95339c",
      "candidateMeaningSha256": "c1ef126fbb1cf4020a80530bf53462fb25377c78cbdb4a4f3d5ab00748cb6ef7"
    },
    "evidence": [
      {
        "sourceFactId": "erpnext.party-customer-management.inputs-outputs",
        "exactLocator": "https://raw.githubusercontent.com/frappe/erpnext/b24c9eba551905e256e336ff170a91a92d197a2f/erpnext/selling/doctype/customer/customer.py#bytes=4208-5556",
        "excerptSha256": "8ba5f1c01106d8f62bff00d4f9be26148e4ee7a80b9511060eb7236e8e857776"
      }
    ],
    "counterexamples": [],
    "boundary": {
      "authorityGrant": "NONE",
      "promotionGrant": "NONE",
      "executionGrant": "NONE"
    }
  },
  {
    "schemaVersion": "pansphaira.cscl01/evidence-cell/v1",
    "systemId": "erpnext",
    "questionId": "states-transitions",
    "state": "AMBIGUOUS",
    "equivalenceProof": {
      "nativeMeaningSha256": "8833890f97f8e7b9badadf8397b54d6a5b9daff103aca371330a701c6cee828b",
      "candidateMeaningSha256": "c1ef126fbb1cf4020a80530bf53462fb25377c78cbdb4a4f3d5ab00748cb6ef7"
    },
    "evidence": [
      {
        "sourceFactId": "erpnext.party-customer-management.states-transitions",
        "exactLocator": "https://raw.githubusercontent.com/frappe/erpnext/b24c9eba551905e256e336ff170a91a92d197a2f/erpnext/selling/doctype/customer/customer.json#bytes=5012-10334",
        "excerptSha256": "6846289e94bf8a37f60ac8a41bff7c5ed904e6004f2e6e454e53f4a913a97c1c"
      }
    ],
    "counterexamples": [
      "Disabled and Is Frozen are separate Check fields with different stated effects; no unified Customer status transition is asserted."
    ],
    "boundary": {
      "authorityGrant": "NONE",
      "promotionGrant": "NONE",
      "executionGrant": "NONE"
    }
  },
  {
    "schemaVersion": "pansphaira.cscl01/evidence-cell/v1",
    "systemId": "erpnext",
    "questionId": "events",
    "state": "SUPPORTED",
    "equivalenceProof": {
      "nativeMeaningSha256": "f4315f9ce77361221d4297363fed52a72315c9021a44d517a134c931023ab641",
      "candidateMeaningSha256": "c1ef126fbb1cf4020a80530bf53462fb25377c78cbdb4a4f3d5ab00748cb6ef7"
    },
    "evidence": [
      {
        "sourceFactId": "erpnext.party-customer-management.events",
        "exactLocator": "https://raw.githubusercontent.com/frappe/erpnext/b24c9eba551905e256e336ff170a91a92d197a2f/erpnext/selling/doctype/customer/customer.py#bytes=3583-13613",
        "excerptSha256": "f649b9833f52d5ed314cd5f12263baac0a0f7efb9144190746ea4cf6884eea4d"
      }
    ],
    "counterexamples": [],
    "boundary": {
      "authorityGrant": "NONE",
      "promotionGrant": "NONE",
      "executionGrant": "NONE"
    }
  },
  {
    "schemaVersion": "pansphaira.cscl01/evidence-cell/v1",
    "systemId": "erpnext",
    "questionId": "preconditions",
    "state": "SUPPORTED",
    "equivalenceProof": {
      "nativeMeaningSha256": "5c0308b47a6b5c7f5d8ea47678e506ff64060915ba2cdf992340af41fec653c1",
      "candidateMeaningSha256": "c1ef126fbb1cf4020a80530bf53462fb25377c78cbdb4a4f3d5ab00748cb6ef7"
    },
    "evidence": [
      {
        "sourceFactId": "erpnext.party-customer-management.preconditions",
        "exactLocator": "https://raw.githubusercontent.com/frappe/erpnext/b24c9eba551905e256e336ff170a91a92d197a2f/erpnext/selling/doctype/customer/customer.py#bytes=12054-12384",
        "excerptSha256": "387e359383492727a5e3f566a2c46d8bcf34975a95feb2a8c1686040effebe5d"
      }
    ],
    "counterexamples": [],
    "boundary": {
      "authorityGrant": "NONE",
      "promotionGrant": "NONE",
      "executionGrant": "NONE"
    }
  },
  {
    "schemaVersion": "pansphaira.cscl01/evidence-cell/v1",
    "systemId": "erpnext",
    "questionId": "invariants",
    "state": "SUPPORTED",
    "equivalenceProof": {
      "nativeMeaningSha256": "bf8261f36c9ca8ec8f8df6fe70f9850e8b93d3d3cfd0b59530a27356a6434ba0",
      "candidateMeaningSha256": "c1ef126fbb1cf4020a80530bf53462fb25377c78cbdb4a4f3d5ab00748cb6ef7"
    },
    "evidence": [
      {
        "sourceFactId": "erpnext.party-customer-management.invariants",
        "exactLocator": "https://raw.githubusercontent.com/frappe/erpnext/b24c9eba551905e256e336ff170a91a92d197a2f/erpnext/selling/doctype/customer/customer.py#bytes=6396-6650",
        "excerptSha256": "131f53544e197c7f472a7d3a732efc88de716c90c9d2839eac8d8eb2eb33b6fe"
      }
    ],
    "counterexamples": [],
    "boundary": {
      "authorityGrant": "NONE",
      "promotionGrant": "NONE",
      "executionGrant": "NONE"
    }
  },
  {
    "schemaVersion": "pansphaira.cscl01/evidence-cell/v1",
    "systemId": "erpnext",
    "questionId": "exceptions-errors",
    "state": "SUPPORTED",
    "equivalenceProof": {
      "nativeMeaningSha256": "fa387f00b6bfd5bfa7b232cbfe79f0374079fa3a0511e6628b70613271861664",
      "candidateMeaningSha256": "c1ef126fbb1cf4020a80530bf53462fb25377c78cbdb4a4f3d5ab00748cb6ef7"
    },
    "evidence": [
      {
        "sourceFactId": "erpnext.party-customer-management.exceptions-errors",
        "exactLocator": "https://raw.githubusercontent.com/frappe/erpnext/b24c9eba551905e256e336ff170a91a92d197a2f/erpnext/selling/doctype/customer/customer.py#bytes=8037-12384",
        "excerptSha256": "bd3023fa91cdde26cf6e6f619d75681f56750c1f7586ee781ff3567078e4fa5b"
      }
    ],
    "counterexamples": [],
    "boundary": {
      "authorityGrant": "NONE",
      "promotionGrant": "NONE",
      "executionGrant": "NONE"
    }
  },
  {
    "schemaVersion": "pansphaira.cscl01/evidence-cell/v1",
    "systemId": "erpnext",
    "questionId": "readbacks",
    "state": "SUPPORTED",
    "equivalenceProof": {
      "nativeMeaningSha256": "c701b7da4e1ff8ead11e576f82cfb29722016863f314d04771caee616ab09fc0",
      "candidateMeaningSha256": "c1ef126fbb1cf4020a80530bf53462fb25377c78cbdb4a4f3d5ab00748cb6ef7"
    },
    "evidence": [
      {
        "sourceFactId": "erpnext.party-customer-management.readbacks",
        "exactLocator": "https://raw.githubusercontent.com/frappe/erpnext/b24c9eba551905e256e336ff170a91a92d197a2f/erpnext/selling/doctype/customer/customer.py#bytes=3583-9637",
        "excerptSha256": "4bbaaed7bcc37bc404c9373ec0d3f3739203b615e73ea1a50eca56e07a1939b1"
      }
    ],
    "counterexamples": [],
    "boundary": {
      "authorityGrant": "NONE",
      "promotionGrant": "NONE",
      "executionGrant": "NONE"
    }
  },
  {
    "schemaVersion": "pansphaira.cscl01/evidence-cell/v1",
    "systemId": "erpnext",
    "questionId": "api-service-exposure",
    "state": "SUPPORTED",
    "equivalenceProof": {
      "nativeMeaningSha256": "dc393095d07312f5c3fe888a50cfca5e86beac8f7d9856d2b5d40cadf64b44a5",
      "candidateMeaningSha256": "c1ef126fbb1cf4020a80530bf53462fb25377c78cbdb4a4f3d5ab00748cb6ef7"
    },
    "evidence": [
      {
        "sourceFactId": "erpnext.party-customer-management.api-service-exposure",
        "exactLocator": "https://raw.githubusercontent.com/frappe/erpnext/b24c9eba551905e256e336ff170a91a92d197a2f/erpnext/selling/doctype/customer/customer.py#bytes=6653-15426",